{
  "$schema": "http://json-schema.org/draft-07/schema#",
  "$id": "moeb/signal.schema.json",
  "title": "Moeb Signal",
  "description": "Schema for a diagnostic signal emitted by the QA Architect during a moeb run end-of-skill review or post-run signal retrospective. Each signal file in .moeb/signals/catalogue/ must conform to this schema.",
  "type": "object",
  "required": [
    "signal_id",
    "category",
    "severity",
    "title",
    "description",
    "proposed_resolution",
    "gating_condition",
    "status",
    "occurrence_count",
    "first_seen",
    "last_seen",
    "occurrences"
  ],
  "additionalProperties": false,
  "properties": {
    "signal_id": {
      "type": "string",
      "format": "uuid",
      "description": "Canonical UUID v4 identifier. Stable across all occurrences and status transitions. Never reused or reassigned."
    },
    "category": {
      "type": "string",
      "enum": [
        "Error",
        "NewCapability",
        "SkillImprovement",
        "ToolImprovement",
        "ProcessImprovement",
        "ReasoningImprovement"
      ],
      "description": "Classifies the signal by the kind of improvement it represents. Error: a recoverable failure that degraded run quality or caused a rubric violation. NewCapability: a missing moeb tool or feature that forced an external or unsupported workaround. SkillImprovement: a skill file instruction that produced suboptimal or incorrect agent behaviour. ToolImprovement: a moeb tool implementation defect that did not cause complete failure but increased cost or produced incorrect output. ProcessImprovement: a gap in the run, spec, or fix_signal workflow lifecycle that caused unnecessary manual intervention."
    },
    "severity": {
      "type": "string",
      "enum": [
        "Critical",
        "Major",
        "Minor"
      ],
      "description": "Impact on run quality. Critical: caused a rubric failure, data corruption, or required significant recovery work (e.g. full file rewrite). Major: caused measurable degradation — extra tool calls, partial output loss, or repeated retries — without complete failure. Minor: a process or guidance gap with low immediate impact but recurring cost if unaddressed."
    },
    "title": {
      "type": "string",
      "maxLength": 120,
      "description": "Short, human-readable summary used as the index label and fix_signal selection display. Should be unique across the catalogue and unambiguous without context."
    },
    "description": {
      "type": "string",
      "description": "Full narrative of what happened: observed symptoms, recovery path taken, relevant file paths or tool names, and why the issue recurs. Must be sufficient for a spec author to understand root cause without reading the run trace."
    },
    "proposed_resolution": {
      "type": ["string", "null"],
      "description": "Actionable description of what a fixing specification should accomplish. Used verbatim as the requirement passed to start_spec by fix_signal. Null only when no resolution is known at signal creation time."
    },
    "gating_condition": {
      "type": ["string", "null"],
      "description": "A prerequisite condition that must be satisfied before this signal can be acted on (e.g. 'requires moeb.some-other-spec to be active'). Null when there is no dependency."
    },
    "status": {
      "type": "string",
      "enum": [
        "open",
        "in_progress",
        "spec_written",
        "candidate",
        "resolved",
        "superseded",
        "reopened"
      ],
      "description": "Lifecycle state of the signal. open: the issue persists and no fix has been applied; eligible for fix_signal selection. in_progress: fix_signal has selected and marked this signal with picked_up_at; spec authoring is in progress. spec_written: a specification has been authored and registered in the harness README. candidate: the run implementing the specification passed QA review and a candidate tag was created. resolved: the issue was accepted via accept_candidate and a resolved event was emitted. superseded: a different design decision made the proposed_resolution unnecessary. reopened: a previously resolved signal has recurred and is eligible for re-selection by fix_signal."
    },
    "links": {
      "type": "array",
      "description": "References to artifacts that explain the signal's lifecycle transitions. Expected when status is resolved or superseded; may be omitted when open. Each entry names an artifact type, its identifier, and the relationship type.",
      "items": {
        "type": "object",
        "required": ["artifactType", "id", "type"],
        "additionalProperties": false,
        "properties": {
          "artifactType": {
            "type": "string",
            "enum": ["spec", "signal", "run", "branch"],
            "description": "The kind of artifact being referenced. spec: a moeb specification file, identified by domain.slug. signal: another signal in the catalogue, identified by its UUID signal_id. run: a moeb run artifact, identified by its UUID run_id. branch: a git branch, identified by its branch name."
          },
          "id": {
            "type": "string",
            "description": "Identifier of the referenced artifact. Format varies by artifactType — spec: '<domain>.<slug>' (e.g. 'moeb.deprecate-patch-file-as-default-write-path'); signal: UUID v4 signal_id (e.g. 'b3c4d5e6-f7a8-4b90-c123-d4e5f6a7b8c9'); run: UUID v4 run_id; branch: git branch name (e.g. 'feat/fix-<slug>')."
          },
          "type": {
            "type": "string",
            "enum": [
              "superseded_by",
              "resolved_by",
              "related_to",
              "caused_by",
              "fix"
            ],
            "description": "Nature of the relationship. superseded_by: the referenced artifact adopted a different approach that made this signal's proposed_resolution unnecessary. resolved_by: the referenced artifact directly implemented the fix described in proposed_resolution. related_to: informational cross-reference with no lifecycle dependency. caused_by: the referenced artifact introduced the condition or regression that triggered this signal. fix: the referenced branch was created by fix_signal to autonomously resolve this signal."
          }
        }
      }
    },
    "occurrence_count": {
      "type": "integer",
      "minimum": 1,
      "description": "Total number of times this signal condition has been observed across all runs. Must equal the length of the occurrences array."
    },
    "first_seen": {
      "type": "string",
      "format": "date-time",
      "description": "ISO 8601 timestamp of the first recorded occurrence. Equals occurrences[0].timestamp."
    },
    "last_seen": {
      "type": "string",
      "format": "date-time",
      "description": "ISO 8601 timestamp of the most recent occurrence. Equals first_seen when occurrence_count is 1."
    },
    "occurrences": {
      "type": "array",
      "minItems": 1,
      "description": "Ordered list of individual occurrences, oldest first. Each entry records when the signal condition was observed and in which run.",
      "items": {
        "type": "object",
        "required": ["timestamp", "run_id"],
        "additionalProperties": false,
        "properties": {
          "timestamp": {
            "type": "string",
            "format": "date-time",
            "description": "ISO 8601 timestamp of this individual occurrence."
          },
          "run_id": {
            "type": "string",
            "format": "uuid",
            "description": "UUID of the moeb run in which this occurrence was observed."
          }
        }
      }
    },
    "picked_up_at": {
      "type": "string",
      "format": "date-time",
      "description": "ISO 8601 timestamp set by fix_signal when this signal is selected for autonomous resolution. Absence means the signal has not been picked up. Presence prevents re-selection by subsequent fix_signal invocations."
    },
    "resolved_at": {
      "type": "string",
      "format": "date-time",
      "description": "ISO 8601 timestamp set by accept_candidate when the signal is marked resolved. Absent on all other status values."
    }
  }
}
