{
  "signal_id": "b2f3e4d5-c6a7-4e8f-0a1b-2c3d4e5f6a7b",
  "category": "SkillImprovement",
  "severity": "Minor",
  "title": "Uncommitted path at spec skill exit: .moeb/signals/index.md",
  "description": "spec.skill.md exited with .moeb/signals/index.md uncommitted. This path is not a recognised spec output and was not staged by any git_commit call in this run.",
  "proposed_resolution": "Determine whether .moeb/signals/index.md should be committed in an existing skill phase or handled by a dedicated cleanup step in spec.skill.md.",
  "gating_condition": null,
  "status": "open",
  "occurrence_count": 1,
  "first_seen": "2026-06-04T12:50:00Z",
  "last_seen": "2026-06-04T12:50:00Z",
  "occurrences": [
    { "timestamp": "2026-06-04T12:50:00Z", "run_id": "78e9a812-b006-4ad8-914e-013abe0c02f7" }
  ]
}
