{
  "signal_id": "a989a8b5-8d94-4cf5-94d9-000000000005",
  "category": "SkillImprovement",
  "severity": "Minor",
  "title": "Uncommitted path at spec skill exit: .moeb/signals/catalogue/a8b7c6d5-e4f3-4a2b-9c1d-0e9f8a7b6c5d.signal.json",
  "description": "spec.skill.md exited with .moeb/signals/catalogue/a8b7c6d5-e4f3-4a2b-9c1d-0e9f8a7b6c5d.signal.json uncommitted. This path is not a recognised spec output and was not staged by any git_commit call in this run.",
  "proposed_resolution": "Determine whether signal files emitted during QA review should be committed in an existing skill phase or handled by a dedicated cleanup step in spec.skill.md.",
  "gating_condition": null,
  "status": "open",
  "occurrence_count": 1,
  "first_seen": "2026-06-04T16:15:00Z",
  "last_seen": "2026-06-04T16:15:00Z",
  "occurrences": [
    { "timestamp": "2026-06-04T16:15:00Z", "run_id": "a989a8bd-8d94-4cff-94d9-a59d079e7203" }
  ]
}
