{
  "signal_id": "a989a8b3-8d94-4cf3-94d9-000000000003",
  "category": "SkillImprovement",
  "severity": "Minor",
  "title": "Uncommitted path at spec skill exit: .moeb/metrics/a989a8bd-8d94-4cff-94d9-a59d079e7203.metrics.json",
  "description": "spec.skill.md exited with .moeb/metrics/a989a8bd-8d94-4cff-94d9-a59d079e7203.metrics.json uncommitted. This path is not a recognised spec output and was not staged by any git_commit call in this run.",
  "proposed_resolution": "Determine whether metrics files should be committed in an existing skill phase or handled by a dedicated cleanup step in spec.skill.md.",
  "gating_condition": null,
  "status": "open",
  "occurrence_count": 1,
  "first_seen": "2026-06-04T16:15:00Z",
  "last_seen": "2026-06-04T16:15:00Z",
  "occurrences": [
    { "timestamp": "2026-06-04T16:15:00Z", "run_id": "a989a8bd-8d94-4cff-94d9-a59d079e7203" }
  ]
}
