{
  "signal_id": "b2000001-0529-4001-9001-000000000001",
  "category": "NewCapability",
  "severity": "Major",
  "title": "Missing moeb tool: Read (large MCP result files)",
  "description": "Used Claude Code's external Read tool 5 times to access oversized MCP tool result files (mcp-moeb-start_run and mcp-moeb-grep_files outputs saved to .txt paths by the MCP result size limiter). No moeb equivalent exists for reading truncated MCP tool results. This caused a moeb-tool-origin rubric failure.",
  "proposed_resolution": "Run moeb spec to introduce a kernel mechanism that handles oversized tool results inline (e.g., streaming, chunked read via read_file_range on the result file), eliminating the need for external file reads.",
  "gating_condition": null,
  "status": "open",
  "occurrence_count": 1,
  "first_seen": "2026-05-29T09:50:00Z",
  "last_seen": "2026-05-29T09:50:00Z",
  "occurrences": [
    { "timestamp": "2026-05-29T09:50:00Z", "run_id": "296e9eb4-c240-4e28-a2eb-a4d0c7aa3bd6" }
  ]
}
