{
  "signal_id": "6a4b8c3d-2e9f-4a0b-c1d4-7f8a9b0c1d2e",
  "category": "Error",
  "severity": "Critical",
  "title": "Tool error not recovered: patch_file attempt 2 on .moeb/README.md",
  "description": "patch_file returned 'old_string not found' on a second attempt with an old_string variant that included an explicit blank line between the last moeb row and '### vcs'. This was a retry of attempt 1 with a different old_string hypothesis. The write_file fallback successfully applied the change.",
  "proposed_resolution": "Same as attempt 1 signal (5f3a7b2c-1d8e-4f9a-b0c3-6e7f8a9b0c1d) — diagnose CRLF normalization in patch_file.rs. Additionally, the retry itself violated the spec.skill.md instruction 'do not retry patch_file'. This contributed to additional tool calls before the write_file fallback.",
  "gating_condition": null,
  "status": "open",
  "occurrence_count": 1,
  "first_seen": "2026-05-31T17:00:00Z",
  "last_seen": "2026-05-31T17:00:00Z",
  "occurrences": [
    { "timestamp": "2026-05-31T17:00:00Z", "run_id": "3bf20026-90d6-4f59-a9d2-d3480d0a8ee4" }
  ]
}
