{
  "signal_id": "a2b3c4d5-e6f7-4081-92a3-b4c5d6e7f8a0",
  "category": "Error",
  "severity": "Minor",
  "title": "patch_file old_string not found on signal catalogue file",
  "description": "patch_file failed with 'old_string not found' on .moeb/signals/catalogue/a1000012-0529-4000-8000-000000000012.signal.json when adding picked_up_at and fix_branch fields. The moeb.patch-file-crlf-normalize spec is active but did not prevent this failure on a Windows CRLF file.",
  "proposed_resolution": "Add a regression test to patch_file.rs covering a CRLF file with an LF old_string. Verify normalize_line_endings is applied to both the file content and the old_string before matching.",
  "gating_condition": null,
  "status": "open",
  "occurrence_count": 1,
  "first_seen": "2026-06-04T18:00:41Z",
  "last_seen": "2026-06-04T18:00:41Z",
  "occurrences": [
    { "timestamp": "2026-06-04T18:00:41Z", "run_id": "c9580f7d-e40d-4544-9322-4de3cbde3a2f" }
  ]
}
