{
  "signal_id": "e5f6a7b8-c9d0-4b1c-3d4e-5f6a7b8c9d0e",
  "category": "SkillImprovement",
  "severity": "Minor",
  "title": "Uncommitted path at spec skill exit: .moeb/signals/catalogue/7a2f8c3b-d4e1-4f9a-b5c2-6d7e8f9a0b1c.signal.json",
  "description": "spec.skill.md exited with .moeb/signals/catalogue/7a2f8c3b-d4e1-4f9a-b5c2-6d7e8f9a0b1c.signal.json uncommitted. This path is not a recognised spec output and was not staged by any git_commit call in this run.",
  "proposed_resolution": "Determine whether QA signal files should be committed in an existing skill phase or handled by a dedicated cleanup step in spec.skill.md.",
  "gating_condition": null,
  "status": "open",
  "occurrence_count": 1,
  "first_seen": "2026-06-04T12:50:00Z",
  "last_seen": "2026-06-04T12:50:00Z",
  "occurrences": [
    { "timestamp": "2026-06-04T12:50:00Z", "run_id": "78e9a812-b006-4ad8-914e-013abe0c02f7" }
  ]
}
